URL,Title,Body,Hyperlink
https://www.thebell.co.kr/free/content/ArticleView.asp?key=202510301023088080106080&lcode=00&page=8&svccode=00,"[SK그룹 인사 풍향계]SKB, 김성수 신임 사장 선임 '체질 개선 특명'",본업인 유료방송 정체로 체질 개선이 요구되는 SK브로드밴드가 통신·미디어 양쪽을 아우른 베테랑을 새 수장으로 택했다. 김성수 신임 사장은 계열사간 시너지를 앞세워 새 성장 동력 발굴에 나설 전망이다...,"=HYPERLINK(""https://www.thebell.co.kr/free/content/ArticleView.asp?key=202510301023088080106080&lcode=00&page=8&svccode=00"", ""[SK그룹 인사 풍향계]SKB, 김성수 신임 사장 선임 '체질 개선 특명'"")"
https://www.thebell.co.kr/free/content/ArticleView.asp?key=202510300925317400105371&lcode=00&page=8&svccode=00,"포스코이앤씨, 폴란드 사업 미수금 회수 '박차'",포스코이앤씨가 야심차게 진출한 폴란드에서 두번째 프로젝트를 마무리 짓지 못하고 있는 것으로 나타났다. 당초 지난해 말까지 공사를 마쳤어야 하지만 공기가 지연되면서 추가 원가가 투입되고 대손상각비 등...,"=HYPERLINK(""https://www.thebell.co.kr/free/content/ArticleView.asp?key=202510300925317400105371&lcode=00&page=8&svccode=00"", ""포스코이앤씨, 폴란드 사업 미수금 회수 '박차'"")"
https://www.thebell.co.kr/free/content/ArticleView.asp?key=202510300737534300107548&lcode=00&page=8&svccode=00,"[VC 투자기업]포스포, 일본 '스탠리'에 형광소재 공급",소재전문기업 포스포가 일본 전등 제조업체 '스탠리일렉트릭(이하 스탠리)'와 형광소재 'Phosphor in Glass(PIG)' 공급 계약을 맺는다. 지난 수년 동안 협업을 이어가면서 쌓아온 네트워...,"=HYPERLINK(""https://www.thebell.co.kr/free/content/ArticleView.asp?key=202510300737534300107548&lcode=00&page=8&svccode=00"", ""[VC 투자기업]포스포, 일본 '스탠리'에 형광소재 공급"")"
https://www.thebell.co.kr/free/content/ArticleView.asp?key=202510301028006280106586&lcode=00&page=9&svccode=00,"[SK그룹 인사 풍향계]SK하이닉스, 차선용 승진 '5사장단 체제 복귀'",SK하이닉스가 5사장단 체제로 돌아왔다. 지난해 사업부문을 5개 조직으로 재편한 이후 후속 조치로 풀이된다. 당시 SK하이닉스는 핵심 기능별로 책임과 권한을 부여해 신속한 의사결정이 가능하도록 'C...,"=HYPERLINK(""https://www.thebell.co.kr/free/content/ArticleView.asp?key=202510301028006280106586&lcode=00&page=9&svccode=00"", ""[SK그룹 인사 풍향계]SK하이닉스, 차선용 승진 '5사장단 체제 복귀'"")"
https://www.thebell.co.kr/free/content/ArticleView.asp?key=202510300735399740104522&lcode=00&page=9&svccode=00,"'치과 임플란트' 도이프, 20억 첫 기관투자 유치",치과 임플란트를 만드는 의료기기 기업 도이프가 처음으로 기관 투자유치에 성공했다. 우수한 기술력과 실질적인 매출 성과를 만들어내고 있다는 점이 높은 평가를 받았다. 도이프는 글로벌 사업 확장을 목표...,"=HYPERLINK(""https://www.thebell.co.kr/free/content/ArticleView.asp?key=202510300735399740104522&lcode=00&page=9&svccode=00"", ""'치과 임플란트' 도이프, 20억 첫 기관투자 유치"")"
https://www.thebell.co.kr/free/content/ArticleView.asp?key=202510291622597320101347&lcode=00&page=9&svccode=00,"[PF Radar]롯데건설, '광주 쌍령공원' 본PF 전환 과제는",롯데건설이 시공을 맡은 경기 광주 쌍령근린공원 민간공원조성 특례사업 본PF 전환이 내년 상반기로 가시화되고 있다. 다만 사업성 개선을 위해 사업계획 변경승인 절차가 마무리돼야 하는 상황이다. 롯데건...,"=HYPERLINK(""https://www.thebell.co.kr/free/content/ArticleView.asp?key=202510291622597320101347&lcode=00&page=9&svccode=00"", ""[PF Radar]롯데건설, '광주 쌍령공원' 본PF 전환 과제는"")"
https://www.thebell.co.kr/free/content/ArticleView.asp?key=202510301025344960102434&lcode=00&page=9&svccode=00,"[SK그룹 인사 풍향계]한명진 사장, SKT 무선사업 '구원투수' 투입",한명진 SK스퀘어 대표(사장)가 SK텔레콤으로 복귀한다. 직책은 통신 CIC장(사장)이다. 올해 유심 정보 유출로 타격을 입은 SKT 무선사업부를 원상태로 돌려놓기 위한 인사로 풀이된다.    그는...,"=HYPERLINK(""https://www.thebell.co.kr/free/content/ArticleView.asp?key=202510301025344960102434&lcode=00&page=9&svccode=00"", ""[SK그룹 인사 풍향계]한명진 사장, SKT 무선사업 '구원투수' 투입"")"
https://www.thebell.co.kr/free/content/ArticleView.asp?key=202510290552577520107184&lcode=00&page=9&svccode=00,[VC 자율규제 도입]평가항목 세분화에 업계 ‘셈법 복잡’…전략 수립 분주,벤처캐피탈(VC)업계는 올 하반기부터 본격적으로 자율규제 시스템 도입을 준비하고 있다. 한국벤처캐피탈협회는 지난 10일까지 평가 접수를 진행했고 이르면 다음달까지 모든 평가를 마무리한다는 계획이다....,"=HYPERLINK(""https://www.thebell.co.kr/free/content/ArticleView.asp?key=202510290552577520107184&lcode=00&page=9&svccode=00"", ""[VC 자율규제 도입]평가항목 세분화에 업계 ‘셈법 복잡’…전략 수립 분주"")"
https://www.thebell.co.kr/free/content/ArticleView.asp?key=202510301114064200106278&lcode=00&page=9&svccode=00,"[SK그룹 인사 풍향계]SKT, 정재헌 신임 CEO 선임 '위기관리 대응' 중책",정재헌 SKT 최고거버넌스책임자(CGO)가 SKT의 새로운 수장이 됐다. 판사로 오래 재직했던 경험을 바탕으로 준법 경영 전문가로서 고객 개인정보 유출로 인한 타격을 최소화하는 데 공을 세웠다. 성...,"=HYPERLINK(""https://www.thebell.co.kr/free/content/ArticleView.asp?key=202510301114064200106278&lcode=00&page=9&svccode=00"", ""[SK그룹 인사 풍향계]SKT, 정재헌 신임 CEO 선임 '위기관리 대응' 중책"")"
https://www.thebell.co.kr/free/content/ArticleView.asp?key=202510301121572200104539&lcode=00&page=9&svccode=00,"[SK그룹 인사 풍향계]SK실트론, 정광진 사장 취임 '첫 내부승진 사례'",SK실트론이 리더십 재편에 나선다. 두산 등과 인수합병(M&A) 논의가 이뤄지는 상황이어서 이목이 쏠린다. 기존 SK실트론 경영진이 다른 그룹사로 이동하는 사례를 볼 때 신임 사장의 추후 행보도 관...,"=HYPERLINK(""https://www.thebell.co.kr/free/content/ArticleView.asp?key=202510301121572200104539&lcode=00&page=9&svccode=00"", ""[SK그룹 인사 풍향계]SK실트론, 정광진 사장 취임 '첫 내부승진 사례'"")"
https://www.thebell.co.kr/free/content/ArticleView.asp?key=202510301127572040108925&lcode=00&page=9&svccode=00,"[SK그룹 인사 풍향계]유영상, SKT 떠나 그룹 AI전략 리딩 '계열 시너지' ...",유영상 사장이 SKT 수장 자리를 내려놓고 앞으론 SK그룹 AI전략을 이끄는 역할을 맡는다. SK수펙스추구협의회 AI위원회 위원장으로 선임됐다. SKT 수장 시절 기업 AI컴퍼니 전환과 성공적인 투...,"=HYPERLINK(""https://www.thebell.co.kr/free/content/ArticleView.asp?key=202510301127572040108925&lcode=00&page=9&svccode=00"", ""[SK그룹 인사 풍향계]유영상, SKT 떠나 그룹 AI전략 리딩 '계열 시너지' ..."")"
https://www.thebell.co.kr/free/content/ArticleView.asp?key=202510301135132520109095&lcode=00&page=9&svccode=00,"[SK그룹 인사 풍향계]SK스퀘어, 김정규 대표 내정 '글로벌 전문가 전면에'","SK스퀘어가 김정규 SK㈜ 비서실장을 신임 사장으로 선임하고 대표이사로 내정했다. 그는 해외 사업 전문가다. SK플래닛 미국지사 팀장, SK텔레콤 말레이시아 오피스 지사장, 시티그룹 미국 합작사 담...","=HYPERLINK(""https://www.thebell.co.kr/free/content/ArticleView.asp?key=202510301135132520109095&lcode=00&page=9&svccode=00"", ""[SK그룹 인사 풍향계]SK스퀘어, 김정규 대표 내정 '글로벌 전문가 전면에'"")"
https://www.thebell.co.kr/free/content/ArticleView.asp?key=202510301239343720109291&lcode=00&page=9&svccode=00,"SK쉴더스, 해킹 사태 탓 외부행사 연기 '대외활동 위축'",SK쉴더스가 올 11월에 진행할 예정이었던 보안 행사 '사이버 시큐리티 미디어데이'를 잠정 연기했다. SK쉴더스의 보안 역량을 대외에 알리는 데 그치지 않고 잠재 고객과 파트너를 만나는 창구로도 활...,"=HYPERLINK(""https://www.thebell.co.kr/free/content/ArticleView.asp?key=202510301239343720109291&lcode=00&page=9&svccode=00"", ""SK쉴더스, 해킹 사태 탓 외부행사 연기 '대외활동 위축'"")"
https://www.thebell.co.kr/free/content/ArticleView.asp?key=202510301323585560105821&lcode=00&page=10&svccode=00,"삼성전자, 엔비디아 HBM 납품 드디어 공식화 '날갯짓'",삼성전자의 디바이스솔루션(DS)부문이 반등을 넘어 정상궤도에 들어서고 있다. 가장 큰 호재는 엔비디아 공급망 진입이다. 인공지능(AI) 데이터센터 투자 확산으로 삼성전자도 고대역폭 메모리(HBM) ...,"=HYPERLINK(""https://www.thebell.co.kr/free/content/ArticleView.asp?key=202510301323585560105821&lcode=00&page=10&svccode=00"", ""삼성전자, 엔비디아 HBM 납품 드디어 공식화 '날갯짓'"")"
https://www.thebell.co.kr/free/content/ArticleView.asp?key=202510301547181360102748&lcode=00&page=10&svccode=00,"부담 커지는 KT, 전고객 유심 교체시 비용 '2100억'",KT가 소액결제 해킹 사고 대책으로 전고객 대상 유심 교체 방안 논의에 본격 돌입한다. 그간 피해가 확인된 고객 대상 보상안만 제안해 재무 부담이 크지 않았지만 전고객으로 범위를 확장하면 사안이 달...,"=HYPERLINK(""https://www.thebell.co.kr/free/content/ArticleView.asp?key=202510301547181360102748&lcode=00&page=10&svccode=00"", ""부담 커지는 KT, 전고객 유심 교체시 비용 '2100억'"")"
https://www.thebell.co.kr/free/content/ArticleView.asp?key=202510301602227960104073&lcode=00&page=10&svccode=00,"[IR Briefing]'공공 AI 선점' 삼성SDS, 행안부·교육청 솔루션 공급",삼성SDS가 공공 부문에서 인공지능(AI) 사업 확대에 속도를 내고 있다. 공공 부문은 AI 분야에서 실질적인 수익 창출이 가능한 시장으로 평가된다.    삼성SDS는 우선 '브리티 코파일럿'을 통...,"=HYPERLINK(""https://www.thebell.co.kr/free/content/ArticleView.asp?key=202510301602227960104073&lcode=00&page=10&svccode=00"", ""[IR Briefing]'공공 AI 선점' 삼성SDS, 행안부·교육청 솔루션 공급"")"
https://www.thebell.co.kr/free/content/ArticleView.asp?key=202510301620226200106652&lcode=00&page=10&svccode=00,"[Company Watch]'최대 실적' 대한전선, 넥스트 스텝 '동남아·아프리카...",대한전선이 3분기 역대 최대 실적을 달성하며 글로벌 전력 인프라 시장에서 입지를 굳히고 있다. 해저케이블을 비롯한 고부가 전력망 수요 증가가 실적을 견인했고 사상 최대 수주잔고를 기반으로 성장세를 ...,"=HYPERLINK(""https://www.thebell.co.kr/free/content/ArticleView.asp?key=202510301620226200106652&lcode=00&page=10&svccode=00"", ""[Company Watch]'최대 실적' 대한전선, 넥스트 스텝 '동남아·아프리카..."")"
https://www.thebell.co.kr/free/content/ArticleView.asp?key=202510301640304600105674&lcode=00&page=10&svccode=00,"[IR Briefing]LG디스플레이, 정철동 공언 '연간 흑자 가시화'",LG디스플레이가 2분기 적자를 딛고 3분기 흑자를 냈다. 누적 영업이익이 3485억원으로 연간 턴어라운드를 목전에 뒀다. 2023년 말 부임한 정철동 사장이 초반부터 강조해온 목표인 만큼 안팎의 기...,"=HYPERLINK(""https://www.thebell.co.kr/free/content/ArticleView.asp?key=202510301640304600105674&lcode=00&page=10&svccode=00"", ""[IR Briefing]LG디스플레이, 정철동 공언 '연간 흑자 가시화'"")"
https://www.thebell.co.kr/free/content/ArticleView.asp?key=202510301746563960109511&lcode=00&page=10&svccode=00,"[i-point]이브이첨단소재, ""유증 자금 에스크로 관리""",이브이첨단소재는 30일 임시주주총회 이후 주주간담회를 열어 유상증자 자금 집행 계획과 베트남 제2공장 증설 계획을 발표했다고 30일 밝혔다.    이번 간담회에서는 △2025년 영업실적과 2026년...,"=HYPERLINK(""https://www.thebell.co.kr/free/content/ArticleView.asp?key=202510301746563960109511&lcode=00&page=10&svccode=00"", ""[i-point]이브이첨단소재, """"유증 자금 에스크로 관리"""""")"
https://www.thebell.co.kr/free/content/ArticleView.asp?key=202510301743464240108229&lcode=00&page=10&svccode=00,"[Company Watch]LG이노텍, 글로벌 생산거점 확장 속 실적 반등","LG이노텍이 어려운 경영환경을 마주한 가운데 반등에 성공했다. 애플 신제품 출시에 따른 계절적 성수기 진입, 반도체 기판 사업 호조 등이 맞물린 결과다.    LG이노텍이 실행 중인 글로벌 생산거점...","=HYPERLINK(""https://www.thebell.co.kr/free/content/ArticleView.asp?key=202510301743464240108229&lcode=00&page=10&svccode=00"", ""[Company Watch]LG이노텍, 글로벌 생산거점 확장 속 실적 반등"")"
https://www.thebell.co.kr/free/content/ArticleView.asp?key=202510301745154720109666&lcode=00&page=10&svccode=00,"안랩, 1년 만에 자사주 매입 재개 '주가 방어 포석'",안랩이 작년에 이어 올해 자기주식 매입 계획을 발표했다. 작년 한 해에만 160억원을 들여 자기주식을 사들인 가운데 추가 매입을 알렸다.    배경에는 주가 부진이 있다. 안랩은 올해 4월 창업주인...,"=HYPERLINK(""https://www.thebell.co.kr/free/content/ArticleView.asp?key=202510301745154720109666&lcode=00&page=10&svccode=00"", ""안랩, 1년 만에 자사주 매입 재개 '주가 방어 포석'"")"
https://www.thebell.co.kr/free/content/ArticleView.asp?key=202510302203386880105376&lcode=00&page=10&svccode=00,"""좋은 날 아닌가요"" 이재용, 미국 관세 타결에 '미소'","이재용 삼성전자 회장이 젠슨 황 엔비디아 CEO, 정의선 현대차그룹 회장과의 치맥 회동 이후 미국 관세 타결에 대한 소회를 밝혔다. 한 마디로 '좋은 날'이라고 표현했다.    30일 서울 삼성동 ...","=HYPERLINK(""https://www.thebell.co.kr/free/content/ArticleView.asp?key=202510302203386880105376&lcode=00&page=10&svccode=00"", """"""좋은 날 아닌가요"""" 이재용, 미국 관세 타결에 '미소'"")"
https://www.thebell.co.kr/free/content/ArticleView.asp?key=202510281526157680103259&lcode=00&page=10&svccode=00,"[그룹의 변신 Before&After]미래사업 육성, 신성장 동력 '벤처투자'",허태수 GS그룹 회장 체제 출범 후 가장 큰 변화는 미래사업 육성이다. 2020년 취임한 허 회장은 2022년 국내 첫 지주회사 기업주도형벤처캐피털(CVC)를 설립한 뒤 적극적으로 스타트업 발굴 및...,"=HYPERLINK(""https://www.thebell.co.kr/free/content/ArticleView.asp?key=202510281526157680103259&lcode=00&page=10&svccode=00"", ""[그룹의 변신 Before&After]미래사업 육성, 신성장 동력 '벤처투자'"")"
https://www.thebell.co.kr/free/content/ArticleView.asp?key=202510271443209640107189&lcode=00&page=11&svccode=00,[그룹의 변신 Before&After]‘정중동’ 행보 끝내고 신사업 노크하는 허태...,GS그룹은 느리지만 일관된 방향성과 꾸준함으로 변화를 추구하고 있다. 과거 에너지·유통·건설 등 그룹의 3대 핵심 사업에 집중하며 그외 사업군에 대한 투자는 인색했다. 그러나 최근에는 요기요와 휴젤...,"=HYPERLINK(""https://www.thebell.co.kr/free/content/ArticleView.asp?key=202510271443209640107189&lcode=00&page=11&svccode=00"", ""[그룹의 변신 Before&After]‘정중동’ 행보 끝내고 신사업 노크하는 허태..."")"
